benefits,company_description,company_locations,company_logo,company_name,company_website,department,description,employmentType,excerpt,lastUpdated,requirements,title,url
Remote work; Professional Development stipend; Health Insurance; Dental/Vision Plan,"GEM Technologies is a NYC based technology consulting firm and MSP. We leverage our partnership with large, mainstream companies (like Microsoft, VMware, Citrix, and more) to develop and integrate custom on-premise and cloud based solutions for our customers. We also manage and maintain these solutions for our clients after the initial implementation is completed. Our customer service is top of the line and our customers know this! So, we've been growing and now we are seeking top-notch people to join our team! Are you up to the challenge? If so, submit your information and resume using this page and someone will be in touch with you. ","New York, New York, United States",https://workablehr.s3.amazonaws.com/uploads/account/logo/112611/ShareFileLogo.jpg,GEM Technologies,http://www.gemtechnologies.net,New York,"The Company: GEM Technologies is a Managed Services Provider that delivers personalized solutions to help local businesses make the most of their technology. At GEM Technologies, we are the New York City area’s leading experts in emerging technology implementation. We deliver comprehensive and scalable solutions that keep businesses competitive, secure, and thriving. With the threat of cyber-attacks, and consumer and business digital adoption moving forward at such a rapid pace, it has never been more critical to partner with a professional service provider who can keep up with emerging technology development. The Role:The Senior Systems Engineer is responsible for the maintenance, configuration, and reliable operation of IT infrastructure, cloud platforms and computer systems. You will participate in research and development to continuously improve and keep up with IT business needs of the organization. You will also actively identify and resolve problems within the IT infrastructure that can lead to work disruptions within the company. You will also have the opportunity to work with multiple clients, providing them with expert technical support and ensuring their systems are secure and functioning at peak performance. Responsibilities: Design, implement and maintain server and cloud-based computing solutions Provide expert technical support to clients, resolving any issues related to their systems Analyze and optimize system performance, identifying areas for improvement Create and maintain documentation of system configurations, procedures and troubleshooting guides Stay up-to-date with emerging technologies and trends in the field of systems engineering Experience with cybersecurity, including knowledge of firewalls and best practices for securing systems Experience with disaster recovery and regaining access and functionality to IT infrastructure While this is a remote position, some of your work will be performed onsite at client locations throughout the NYC metro area. Requirements: Ability to communicate effectively with organizational personnel and clients. Customer service orientation (e. g. , patience, positive customer-friendly attitude, active listening, empathy, professionalism, etc. ). Adapt easily to rapid changes in requests, processes, and procedures. Ability to set goals and prioritize tasks. Uses an objective, logical, rigorous, and detail-oriented approach to work. Resolves problems promptly, accurately and in such a way as to prevent future occurrence. Strong ability to manage multiple responsibilities and competing priorities, constantly reprioritizing based on new information or shifting deadlines. Maintains confidentiality and uses sound judgement when discussing technical or sensitive matters. Strong attitude and desire to learn new technologies. Maintain current skills and strive to acquire new technical knowledge based on current industry trends. Highly motivated self-starter &amp; independent worker who can produce high level results consistently with minimal supervision. Must work well in a team environment and participate in working meetings Hybrid position – Based in NYC area, occasional client visits are an integral part of this role Must maintain a clean and presentable work environment for video calls when working from home as well as in the office Core Technical Knowledge:MS 365 and O365 Amazon Web Services Microsoft Azure Google Cloud Platform Cloud Software Google Workspace PowerShell Manage and maintain DNS infrastructure VDI Administration MFA Administration MDM Solutions Experience with NOC software and PSAs Experience with Microsoft Exchange Experience with router/switch implementation and VoIP systems Knowledge of disaster recovery Scripting or programming experience Experience with cloud servers RMM Experience ",Full-time,"The Company: GEM Technologies is a Managed Services Provider that delivers personalized solutions to help local businesses make the most of their technology. At GEM Technologies, we are the New York City area’s leading experts in emerging technology im...",1736726400,"A bachelor’s degree in Computer Science, Information Technology, or a related field (or equivalent work experience).; At least five years of proven experience as a Senior Systems Engineer, with a track record of successfully delivering complex IT projects.; Systems administration: Proficiency in managing and maintaining computer systems.; Network protocols: Understanding of network communication protocols.; Hardware configuration: Knowledge of configuring hardware components.; Software deployment: Ability to deploy and manage software solutions.; Scripting languages: Excellent scripting skills using languages.; Security knowledge: Familiarity with system security practices.; Cloud-based computing: Experience with cloud platforms.",Systems Security Administrator,https://jobs.workable.com/view/qemy1T8hMqrHBTGvmpYTvw/hybrid-senior-systems-engineer-in-new-york-at-gem-technologies
"Significant career development opportunities exist as the company grows. The position offers a unique opportunity to be part of a small, fast-growing, challenging and entrepreneurial environment, with a high degree of individual responsibility.",,"Jersey City, New Jersey, United States",,Tiger Analytics,http://www.tigeranalytics.com,Data Engineering,"Tiger Analytics is an advanced analytics consulting firm. We are the trusted analytics partner for several Fortune 100 companies, enabling them to generate business value from data. Our consultants bring deep expertise in Data Science, Machine Learning, and AI. Our business value and leadership have been recognized by various market research firms, including Forrester and Gartner. We are one of the highest-rated employers on Glassdoor. If you are passionate to work on unstructured business problems that can be solved using data, we would like to talk to you. Mentorship and solution support to client-facing Data Engineers across key accounts Review data engineer work and proactively establish the adoption of best practices and frameworks that improve productivity and client satisfaction Work with the DevOps, MLE team to onboard and productionize Data Science models at scale. Implement and manage production management processes around data ingestion, transformation, coding utilities, storage, reporting, and other data integration points. Coordinate between onsite and offshore leadership for regular updates Engage key client stakeholders to Review and provide the best solutions on the existing or new architecture requirements. Recommend strategies to improve resiliency, security, and optimize costs. Analyse, architect, design, and actively develop analytics frameworks, data lakes, and other cloud-based data solutions. Design and develop scalable data ingestion frameworks to transform a variety of datasets, capture metadata, lineage and implement data quality ",Full-time,"Tiger Analytics is an advanced analytics consulting firm. We are the trusted analytics partner for several Fortune 100 companies, enabling them to generate business value from data. Our consultants bring deep expertise in Data Science, Machine Learning...",1620864000,"Bachelor’s degree in Computer Science/or any relevant experience in Information systems.; 10 years of experience in the IT field with hands-on experience in system administration and automation; 3-5 years of strong hands-on experience with AWS(or another cloud) in building a Data and Analytics platform on the cloud.; 1+ years of experience with deploying services on Kubernetes on-prem or on-cloud; 3-5 years of strong hands-on expertise on Cloud (AWS/Azure/GCP) with strong experience in working with modern data and analytics frameworks, big data, and DevOps techniques, and is proficient with programming languages (like Python, Java, Scala).; 1-2 yrs experience with Cloud data warehouse (Redshift, Snowflake, BigQuery); Solid understanding of building Data Lakes on Cloud environments - Data Integration, Data Pipeline, Data compute, ML Models and Storage, etc.; Solid knowledge of and experience with Big data and Stream processing frameworks - Spark, Flink, or other; Knowledge of delta lake or similar technology; Exposure to operationalizing ML models @ scale on Cloud; Solid understanding of DevSecOps and cloud security concepts and how to mitigate security risks in the cloud; Must understand the Scrum Agile methodology and have worked on a Scrum team.; Knowledge of SQL, non-relational (NoSQL) databases, and Object Stores; Good experience working on an onsite/offshore model; Knowledge of networking, firewalls, load balancers, etc.; AWS Professional Architect Certification is preferred; Exceptional communication skills and the ability to communicate appropriately with executives and technical teams.",Systems Security Administrator,https://jobs.workable.com/view/7roY7ejC1NpkXwyuRwvpdf/cloud-data-architect-in-jersey-city-at-tiger-analytics
"This is a unique opportunity to work with one of Madison Avenue’s valued clients, a prominent commercial real estate organization. You’ll contribute to innovative projects, tackle real-world challenges, and play a pivotal role in advancing their Salesforce capabilities.; If this sounds like the right fit for you, we’d love to hear from you. Let’s take the next step in your Salesforce career together!",,"New York, New York, United States",,Madison Ave Consulting,http://madisonaveconsulting.com,,"Salesforce Developer – Commercial Real EstateLocation: New York City - HybridSalary: $100, 000. 00 - $125, 000. 00Madison Avenue Consulting is a trusted Salesforce partner dedicated to connecting top talent with organizations that need transformative Salesforce solutions. We are currently seeking a Salesforce Developer for one of our long-standing clients, a prominent commercial real estate organization. This is a full-time role initially requiring regular attendance at the client’s office in New York City during the ramp-up period. This ensures effective knowledge transfer and onboarding. Once these stages are completed, the role can transition to a hybrid model or potentially remote, making it ideal for candidates in the NYC area. About the RoleThis role involves designing and developing custom Salesforce solutions, managing data migration efforts, and collaborating with internal stakeholders to align technical solutions with business goals. In addition, the role requires hands-on Salesforce Administration expertise to support system configuration, maintenance, and optimization. Note: Candidates must be U. S. Citizens or Green Card holders. ",Full-time,"Salesforce Developer – Commercial Real EstateLocation: New York City - HybridSalary: $100,000.00 - $125,000.00Madison Avenue Consulting is a trusted Salesforce partner dedicated to connecting top talent with organizations that need transformative Sales...",1737590400,"Apex Development: Design, develop, and test custom Apex code to enhance platform functionality and address specific business requirements.; Data Management and Migration: Oversee and execute data migrations, ensuring data integrity and smooth transitions between systems.; Salesforce Administration:; Configure and manage Salesforce objects, fields, workflows, validation rules, page layouts, and Lightning Record Pages. Implement and troubleshoot complex flows to support business processes. Manage user permissions, profiles, and data security protocols.; Collaboration: Work closely with admins and internal stakeholders to gather requirements, design scalable solutions, and ensure alignment with business objectives.; System Maintenance: Perform routine system maintenance, resolve technical issues, and ensure optimal platform performance.; Integration Projects: Support future integrations with platforms like Crexi and assist in ensuring seamless functionality across systems. Troubleshooting: Diagnose and resolve platform issues, leveraging best practices to maintain high performance.; Expertise in Apex programming, including triggers, classes, and asynchronous operations.; Familiarity with Lightning Web Components (LWC) and Visualforce.; Experience debugging and enhancing Salesforce functionality using custom code.; Proficiency with Flow Builder, workflows, validation rules, and approval processes.; Expertise in user management, security settings, and data integrity best practices.; Hands-on experience managing Lightning Record Pages and optimizing platform configurations.; Strong knowledge of data migration tools (e.g., Data Loader, Workbench).; Proven experience in managing large-scale data migrations with attention to accuracy and integrity.; Ability to work closely with admins, business users, and other stakeholders to gather requirements and deliver tailored solutions.; Strong communication skills to explain technical concepts to non-technical audiences.; Knowledge of Salesforce best practices to ensure scalable, maintainable solutions.; Minimum 5+ years of Salesforce development and administration experience.; Strong background in Apex, LWC, and data migration efforts.; Proficiency in Salesforce configuration, user management, and platform maintenance.; Experience collaborating with Salesforce admins and stakeholders on internal projects.",Systems Security Administrator,https://jobs.workable.com/view/2fNJWEyP6PBPozVeHpFVCN/hybrid-salesforce-developer---commercial-real-estate-in-new-york-at-madison-ave-consulting
"401K with a generous company match of 4% of your pre-tax salary deferral to help you save for your retirement; Company Profit Sharing Program; Paid Time Off to ensure you have time to rest, recharge, and spend time with your loved ones; Blue Cross Blue Shield Health Insurance coverage; Dental and Vision plan; Optional Supplemental Insurance Plans, including Life Insurance; Dog-Friendly Office - If approved, you can even bring your furry friend to work with you to make your workday more enjoyable and stress-free.","Founded in 1994, Delaney Computer Services, Inc. is one of the most well-known names in Managed IT Services Headquartered in Mahwah, New Jersey, DCS services businesses, municipalities, and not-for-profit organizations throughout Northern New Jersey, NYC, and the Lower Hudson Valley of New York, otherwise known as the tri-state or NYC Metro. As a full-service MSP, we provide our clients with a fully-outsourced, fully-managed IT Support model. Client pricing is a fixed monthly fee, typically based on the number of workforce users and devices within their organization. DCS supplies all hardware and software that the client needs for basic operations and supports various “line of business” and accounting applications. DCS clients are typically businesses with 20-70 employees who use computers to perform their jobs and are in an industry that relies on a need for cybersecurity and industry compliance, such as New York-based insurance companies that have to be compliant with 23 NYCRR Part 500, HIPAA Hi-Tech, FINRA or ITAR compliance. Although many of our clients are generalized small businesses that rely on computers, such as legal, manufacturing, and financial verticals, we focus on cybersecurity and compliance. As a leading Managed IT Service Provider (MSP), DCS consists of highly skilled IT support professionals. They focus as a team on maintaining our client’s IT infrastructure and technology on an ongoing basis. DCS uses the leading MSP industry tools that help us be proactive and in front of issues rather than reactive to problems, help to eliminate unexpected downtime, and reduce helpdesk interactions. By improving cybersecurity understanding, we help foster environments where the client is part of the human firewall, which leads to increased business continuity, lowering expenses due to downtime, and increased efficiency. Our goals are to exceed industry standards for performance, operation, and customer service while achieving sustainable growth in this challenging but ever-expanding field of business to gain an ever-increasing organic market share. ","Mahwah, New Jersey, United States",https://workablehr.s3.amazonaws.com/uploads/account/logo/69977/logo,"Delaney Computer Services, Inc.",https://www.dcsny.com,IT Support,"Are you a skilled IT professional who thrives in hands-on environments and isn’t afraid to get your hands dirty solving real-world problems? Delaney Computer Services, a leading MSP in Northern New Jersey, is looking for an MSP IT Support Specialist to join our dynamic team. This in-office position requires someone who’s ready to tackle everything from troubleshooting complex IT issues to physically racking and stacking network equipment, performing meticulous cable management, and handling on-site client challenges—even on short notice. If you’re adaptable, proactive, and confident enough to de-escalate frustrated clients or assertively guide high-level executives to comply with security protocols, this is the role for you. We're seeking someone who’s eager to ramp up their career, not coast, and who thrives in both team settings and independent problem-solving scenarios. If that’s you, let’s talk!Responsibilities for MSP IT Support Specialist Provide Exceptional IT Support: Deliver timely and effective technical assistance for hardware, software, and network-related issues in both remote and on-site environments. Support Privilege Access Management Systems: Troubleshoot and resolve conflicts stemming from restricted user permissions, ensuring compliance with cybersecurity protocols. Manage VoIP Systems: Configure, troubleshoot and support Vonage Business VoIP systems, including advanced features and call quality optimization. Assist with Self-Service Password Reset (SSPR): Guide users in setting up and utilizing self-service password reset tools, resolving related technical issues as needed. Enforce and Educate on Cybersecurity Policies: Address user resistance to security measures such as MFA, restricted app use, and compliance-based restrictions, while explaining their importance in maintaining a secure IT environment. Troubleshoot Network and Connectivity Issues: Diagnose and resolve Wi-Fi, LAN, and WAN connectivity problems and manage firewalls, switches, and other network hardware. Resolve Hardware and Peripheral Issues: Address computer performance concerns, resolve printer and scanner issues, and perform necessary hardware repairs or replacements. Handle Malware and Threat Mitigation: Detect, remove, and educate users on avoiding cybersecurity threats such as phishing, ransomware, and malware. Support Email and Collaboration Tools: Troubleshoot and resolve issues in Microsoft 365, including Outlook, Teams, SharePoint, and other collaboration tools. Deliver On-Site Support as Needed: Visit client locations to handle more complex issues or installations, ensuring optimal performance and strong client relationships. Physical Work and On-Site Installation: Must have the ability and willingness to perform hands-on tasks such as racking and stacking network equipment, servers, and other hardware. This includes physical labor like lifting equipment (up to 50 lbs), cabling, and ensuring proper hardware installation in client environments. Candidates should be comfortable with physically demanding work and capable of tackling on-site challenges with confidence and professionalism. Demonstrated ability to perform clean and organized cable management during desktop setups, network installations, and other hardware deployments. Attention to detail is essential to ensure cables are properly routed, labeled, and secured for both functionality and aesthetics. Maintain Client Satisfaction: Communicate technical solutions clearly, de-escalate user frustrations, and ensure that clients feel supported and informed. Document and Improve Processes: Create detailed records of support requests and contribute to improving IT support workflows and user education resources. Additional Expectations Conflict Management: Must be able to handle user frustrations calmly and professionally, addressing issues without deferring to management unnecessarily. Proactive Problem Solving: Anticipate client needs and prevent recurring issues through proactive measures. Real-World Experience: Demonstrate hands-on expertise in IT support with an understanding of privilege access management, VoIP systems, and cybersecurity best practices. Preferred qualifications: MS-102 | Microsoft 365 Certified: Administrator Expert - Certifications Cisco CCNA / A+ Security Plus Working understanding of basic cybersecurity principals Experience with Active Directory, Azure Active Directory, and Group Policy. Knowledge of Microsoft Powershell Scripting Knowledge of networking principles and protocols. Knowledge of physical low-voltage cabling principals Familiarity with professional services automation (PSA) software. ",Full-time,"Are you a skilled IT professional who thrives in hands-on environments and isn’t afraid to get your hands dirty solving real-world problems? Delaney Computer Services, a leading MSP in Northern New Jersey, is looking for an MSP IT Support Specialist to...",1734912000,"Microsoft 365 Certified: Fundamentals - Certifications | MS900; Microsoft 365 Certified: Administrator Associate (MS-102) – Highly Preferred; Technical Skills:; Expertise in Microsoft 365 (Exchange, Teams, SharePoint, OneDrive).; Experience with Privilege Access Management platforms and VoIP systems (Vonage Business preferred).; Strong knowledge of cybersecurity best practices (MFA, DNS filtering, BYOD policies).; Networking troubleshooting skills (Wi-Fi, firewalls, switches).; Professional Experience:; 3-4 years in an MSP or similar IT support environment.; Hands-on troubleshooting of hardware, software, and networking issues.; Client-facing experience with conflict resolution skills.; Soft Skills:; Strong communication and ability to explain technical concepts clearly.; Confidence to resolve issues independently without frequent escalation.; Calm under pressure and effective in de-escalating difficult situations.; Other Requirements:; Valid driver’s license with a clean driving record (for occasional on-site visits).; Must be able to lift 50Lbs.; No criminal record (background check required).; 100% Willingness to work in-office full-time with flexibility for on-site support and light travel if necessary.",Systems Security Administrator,https://jobs.workable.com/view/8eci4uNeNtqRuiHgmjxJrL/experienced-msp-it-support-specialist-(not-remote)-in-mahwah-at-delaney-computer-services%2C-inc.
