benefits,company_description,company_locations,company_logo,company_name,company_website,department,description,employmentType,excerpt,lastUpdated,requirements,title,url
,"Aon exists to shape decisions for the better — to protect and enrich the lives of people around the world. Our colleagues provide our clients in over 120 countries and sovereignties with advice and solutions that give them the clarity and confidence to make better decisions to protect and grow their business. As an organization, we are united through trust as one inclusive, diverse team, and we are passionate about helping our colleagues and clients succeed. ","Garden City, New York, United States",https://production-job-board-public.s3.amazonaws.com/logos/ba700634-7c50-4c06-9aad-ec7cbfdaa8f8,Aon,https://www.aon.com/unitedkingdom/default.jsp,,"Aon is looking for a Senior Account Executive to join our Travel Practice. This a hybrid role with the flexibility to work both virtually and from our Miami, FL or New York, NY office. Aon Affinity Travel Practice is a leading global provider of customized, revenue-generating travel insurance programs for some of the best-known brands in consumer travel. We collaborate with partners to optimize this important value-added product/service through program development, carrier brokerage, program structure and distribution strategies that meet defined objectives and targets. We apply intelligent analytics, innovative product design, compelling segmentation strategies and engaging creative materials to impact conversion at the point of travel purchase through our partners’ direct and indirect distribution channels. We strive to deliver continuous growth from this important ancillary offer for the benefit of our travel industry partners and their customers, the underwriting insurers with whom we place these programs and our own shareholders. In addition, we service customers (claimants) through our TPA using proprietary and partner systems and processes through our claims center, call center and robust technology platforms. We aim to accelerate process improvement and value delivery though innovation and digitalization initiatives. Aon is in the business of better decisions At Aon, we shape decisions for the better to protect and enrich the lives of people around the world. As an organization, we are united through trust as one inclusive, diverse team, and we are passionate about helping our colleagues and clients succeed. What the day will look likeServe as senior relationship leader for large, multinational enterprise clients to retain, grow and optimize customer Travel Protection programs for Affinity Travel Practice. Demonstrate and apply knowledge of insurance, underwriting and compliance (ideally in Travel and B-to-B-to-C) environments in client program management Understand client objectives (revenue, risk, compliance, distribution and brand differentiation) and collaborate with C-level stakeholders leveraging analytics, marketing, carrier/compliance, Account Teams to deliver differentiated market value to our clients Continuously monitor clients’ performance, company structure, operations, and credit/risk profile in support of the Travel program. This includes reviewing financials and presenting to stakeholders periodically to ensure full visibility into program performance on a regular cadence. Work with client service team to communicate standards and service performance expectations and ensure appropriate training is provided to client and Aon TPA team. Owns delivery of new solutions for clients by reviewing their needs/capabilities and gaps regularly. Drive growth for the organization by working collaboratively with internal sales producers, Aon United colleagues who service other parts of client’s business, the Affinity Travel Account Executives and other team members to bring in new clients or prospects. This includes contributing to the sales process and leveraging learnings across clients. Domestic Travel to client sites required. Skills and experience that will lead to success Knowledge of Insurance structures, underwriting, travel industry, consumer travel distribution channels desired. Knowledge and experience in Travel of at least 5+ yearsExperience in product development, program optimization and merchandising within and across client portfolios to deliver revenue and margin. Ability to work across clients and functions, effectively synthesize information and develop informative and persuasive decks and analyses for executives / clients. Effective relationship builder, understands and finds levers for expansion internally and externally to deepen relationships. Well-developed communication and presentation skills, effective collaborator across stakeholders to optimize opportunities and mitigate risk. Attention to detail and technical proficiency is critical, while maintaining strategic direction on business and client growth in their space Knowledge of Insurance structures, underwriting, travel industry, consumer travel distribution channels desired. Education:Bachelor's Degree with emphasis in business, preferably finance or accounting, or equivalent work experience. How we support our colleagues In addition to our comprehensive benefits package, we encourage a diverse workforce. Plus, our agile, inclusive environment allows you to manage your wellbeing and work/life balance, ensuring you can be your best self at Aon. Furthermore, all colleagues enjoy two “Global Wellbeing Days” each year, encouraging you to take time to focus on yourself. We offer a variety of working style solutions, but we also recognize that flexibility goes beyond just the place of work. .. and we are all for it. We call this Smart Working! Our continuous learning culture inspires and equips you to learn, share and grow, helping you achieve your fullest potential. As a result, at Aon, you are more connected, more relevant, and more valued. Aon values an innovative, diverse workplace where all colleagues feel empowered to be their authentic selves. Aon is proud to be an equal opportunity workplace. Aon provides equal employment opportunities to all employees and applicants for employment without regard to race, color, religion, creed, sex, sexual orientation, gender identity, national origin, age, disability, veteran, marital, domestic partner status, or other legally protected status. People with criminal histories are encouraged to apply. We welcome applications from all and provide individuals with disabilities with reasonable adjustments to participate in the job application, interview process and to perform essential job functions once onboard. If you would like to learn more about the reasonable accommodations we provide, email ReasonableAccommodations@Aon. com For positions in San Francisco and Los Angeles, we will consider for employment qualified applicants with arrest and conviction record in accordance with local Fair Chance ordinances. Nothing in this job description restricts management's right to assign or reassign duties and responsibilities to this job at any time. Pay Transparency Laws The salary range for this position (intended for U. S. applicants) is $130, 000 to $175, 000 annually. The actual salary will vary based on applicant’s education, experience, skills, and abilities, as well as internal equity and alignment with market data. The salary may also be adjusted based on applicant’s geographic location. This position is eligible to participate in one of Aon’s annual incentive plans to receive an annual discretionary bonus in addition to base salary. The amount of any bonus varies and is subject to the terms and conditions of the applicable incentive plan. We offer you Aon offers a comprehensive package of benefits for full-time and regular part-time colleagues, including, but not limited to: a 401(k) savings plan with employer contributions; an employee stock purchase plan; consideration for long-term incentive awards at Aon’s discretion; medical, dental and vision insurance, various types of leaves of absence, paid time off, including 12 paid holidays throughout the calendar year, 15 days of paid vacation per year, paid sick leave as provided under state and local paid sick leave laws, short-term disability and optional long-term disability, health savings account, health care and dependent care reimbursement accounts, employee and dependent life insurance and supplemental life and AD&amp;D insurance; optional personal insurance policies, adoption assistance, tuition assistance, commuter benefits, and an employee assistance program that includes free counseling sessions. Eligibility for benefits is governed by the applicable plan documents and policies. #LI-CC1#LI-HYBRID 2552853",Full-time,"Aon is looking for a Senior Account Executive to join our Travel Practice. This a hybrid role with the flexibility to work both virtually and from our Miami, FL or New York, NY office. Aon Affinity Travel Practice is a leading global provider of custom...",1738195200,,Technical Support,https://jobs.workable.com/view/j1PLTqRrfRqjSJ8XR9MUTc/senior-account-executive%2C-travel-practice-in-garden-city-at-aon
,"DMV IT Service is a leading IT consulting firm specializing in providing strategic technology solutions for corporate enterprises and high-growth organizations. We focus on IT strategy, infrastructure optimization, and digital transformation to help businesses drive efficiency and achieve their goals. Our team thrives on solving complex challenges and delivering impactful results through innovative and scalable solutions. Join us to be part of a dynamic environment where your contributions directly shape the future of businesses. ","New York, New York, United States",https://workablehr.s3.amazonaws.com/uploads/account/logo/681490/logo,DMV IT Service,https://www.dmvitservice.com/,,"Job Title: Sr. Developer Power PlanLocation: New York, NYEmployment Type: Full-TimeAbout Us:DMV IT Service LLC is a trusted IT consulting firm, delivering tailored solutions to businesses and individuals since 2020. We specialize in optimizing IT infrastructure, providing expert guidance, and supporting workforce needs with top-tier staffing services. Our consulting expertise spans system administration, cybersecurity, networking, and IT operations, empowering clients to achieve their technology goals. With a client-focused approach, we also offer online training and job placements to build long-term IT success. Job Overview:We are seeking a seasoned IT professional with extensive experience in the utility industry and a strong background in PowerPlan integration. The ideal candidate will have at least 8 years of experience in the IT industry, with specific skills in technical support, integration, issue analysis, project leadership, and documentation. ",Full-time,"Job Title: Sr. Developer Power PlanLocation: New York, NYEmployment Type: Full-TimeAbout Us:DMV IT Service LLC is a trusted IT consulting firm, delivering tailored solutions to businesses and individuals since 2020. We specialize in optimizing IT infra...",1738108800,"Technical Support and Integration: Demonstrate a strong technical understanding of integration with PowerPlan and comprehensive knowledge of related business processes.; Issue Analysis and Resolution: Conduct thorough analyses of issues, providing accurate and timely solutions. Proactively address routine problems with minimal supervision and escalate complex issues appropriately.; Project Leadership: Collaborate with various IT groups to support server upgrades, Oracle database enhancements, and application fixes, particularly related to the PowerPlan application.; Documentation and Coding: Ensure high-quality code delivery, document all coding changes comprehensively, and provide accurate work estimates for programming tasks.; Must Have:; 3rd Party Software Integration; Oracle 12c; Oracle Applications PL/SQL; Oracle SQL Developer; PowerBuilder Developer; PowerPlan 2021.x; Nice to Have:; Experience with property records and property tax; Utilities industry experience",Technical Support,https://jobs.workable.com/view/2946ZNuKFaUUnyWx42DbF7/sr.-developer-power-plan-in-new-york-at-dmv-it-service
,"Human answers to business questions - Just Sago. Sago, formerly Schlesinger Group, is the global research and data partner that connects human answers to business questions. Combining our legacy of impact, global reach, and innovative spirit, we enable our clients to solve business problems through extensive audience access and an adaptive range of qualitative and quantitative solutions. We help our clients understand what their customers want and demand — empowering them to make decisions with confidence. As a partner to our clients, their clients, and the industry, Sago seamlessly connects businesses to key insights. ","TELECOMMUTE; New Jersey, United States",https://workablehr.s3.amazonaws.com/uploads/account/logo/524485/logo,Sago,https://sago.com/en/,Recruiting Operations,"POSITION SUMMARY: The primary function of this role is to provide technical support and troubleshooting assistance to customers while hosting live online focus groups and provide high quality product support to our end users via tickets, email, chat, and phone. KEY JOB RESPONSIBILITIES: Independently host online focus group sessions, running on the QualMeeting and QualBoard platform while actively listening and watching each session to provide technical support as needed, aiming for the highest quality experience for our clients and participants. Responsible for promptly answering requests via tickets, chats, emails, and phone, providing exceptional customer service. Perform tasks related to a variety of QualProduct setup and deliverables, including, but not limited to, technical check status, updating session statues, and updating stimuli. Help keep clients and projects organized, documented and on schedule. Ability to anticipate, recognize and resolve technical (hardware, software, application or operational) problems. Ability to handle and resolve customer complaints or issues efficiently. Identify and document product failures. Proactively contribute to departmental process improvement, while maintaining platform proficiency by attending all QualProduct trainings and assisting with certain projects including, video upload, project set up and data manipulation using Excel. Any other duties assigned by management. ",Part-time,"POSITION SUMMARY:&amp;nbsp;The primary function of this role is to provide technical support and troubleshooting assistance to customers while hosting live online focus groups and provide high quality product support to our end users via tickets, email...",1737590400,"Strong technical abilities using a variety of web-based applications, ability to learn new platforms with minimal training and to help others learn new platforms as needed.; Service-oriented - perceptive to others’ needs and naturally inclined to help people, treats co-workers and employees with courteousness, consideration, and tact.; Experience with multiple Desktop and Laptop configurations and environments.; Effectively and efficiently communicate information with internal team and customers.; Ability to work effectively as part of a team - cooperative, flexible, reliable, able to express opinions honestly and constructively.; Multi-tasker - able to juggle multiple tasks/projects at a time with high accuracy, high efficiency, and minimal stress.; Extremely detail-oriented - notices incomplete or incorrect information and strives to ensure everything is accurate; able to focus on details while keeping sight of the big picture.; High School Diploma; Minimum 1 year experience working in a technical support or customer service capacity.; Excellent software skills used to support our clients, employees, and project teams (Excel, Microsoft Office Suite and/or Google Equivalents)",Technical Support,https://jobs.workable.com/view/gDNPhK3fMBJtGTCcWAMV2R/remote-online-focus-group-host---part-time-in-new-jersey-at-sago
A company focused on maintaining a great company culture; An opportunity to make a difference in the company and to be rewarded for doing so; A company that is always looking to improve while adhering to our core principles.; An opportunity for career growth within the organization; Competitive compensation package with variable pay potential and benefits,"Since 2012, we have helped more than 200 charter schools with all things technology. We are passionate about helping schools and kids succeed. ","New York, New York, United States",https://workablehr.s3.amazonaws.com/uploads/account/logo/652659/logo,Inspiroz,http://inspiroz.com,On-site Technicians,"Inspiroz is seeking a driven, detail-oriented School Technology Specialist (STS) to join our on-site IT support team in Harlem, NY. As an STS, you will play a crucial role in supporting the day-to-day technology support across Inspiroz’ portfolio of charter schools. Working under the supervision of an Inspiroz Service Delivery Manager, you will interact regularly with our remote technical support team and various client contacts. For over a decade, Inspiroz has established a reputation in the Managed IT Services industry as a premier provider of charter school focused technology strategy and support. Take the next step in your IT career, and apply today! Key responsibilities for this position include the following: Technical support and problem resolution Take the lead in resolving technical issues that require on-site support. Manage on-site installation, repairs, and maintenance for workstations, network equipment and peripheral devices. Conduct thorough troubleshooting to identify the root cause of problems. Assist with projects on an as-needed basis, collaborating with project teams and stakeholders as required. Act as the liaison between on-site operations and the remote IT support team in India. Communicate technical issues and requirements to the remote team accurately and clearly. Provide detailed information and documentation to facilitate remote troubleshooting and support. Works closely with the remote service desk team to resolve technical issues. Stay up-to-date with the latest technology trends, advancements, and best practices in the education sector. Customer support and service Communicates updates, challenges, and tasks to the client in a clear and timely manner. Listens actively to client concerns and addresses them appropriately. Establishes and maintains strong relationships with clients, fostering a sense of trust and partnership. Assists clients in aligning technology solutions with their specific goals and requirements. Ensures client satisfaction by following up on issue resolution and providing necessary support. Takes personal interest in the quality of work and meeting customer needs. Demonstrates professionalism and clarity in written communication, ensuring accuracy and attention to detail in all email interactions. Responds to emails within two hours during business hours and ensures timely responses to after-hours emails or requests, as per the company's communication policy. ’ Time Entry and Ticket Management Accurately and diligently tracks time spent on-site using ConnectWise Manage's time entry feature. Regularly updates ticket statuses and provides clear and concise notes for effective communication and collaboration. Follows the company's established workflow procedures, including ticket creation, assignment, and resolution processes in ConnectWise Manage. Conducts a thorough review of assigned tickets for the next day before the end of the current shift to prepare effectively. ",Full-time,"Inspiroz is seeking a driven, detail-oriented School Technology Specialist (STS) to join our on-site IT support team in Harlem, NY.&amp;nbsp;&amp;nbsp;As an STS, you will play a crucial role in supporting the day-to-day technology support across Inspir...",1736812800,"Windows Systems; Mac Systems; Active Directory; Networking equipment and concepts; Hardware repairs and installations; Excellent customer service skills; Excellent hands-on technical support skills; Excellent verbal and written communication skills; Ability to demonstrate passion for technology, innovation, troubleshooting, and making a difference.; Ability to adapt to changing situations, be flexible in approach, and effectively multitask.; Ability to self-motivate and work independently when required, taking initiative and ownership of tasks.; Ability to assess own limitations, recognize when to ask for help, and effectively collaborate with others.",Technical Support,https://jobs.workable.com/view/iRJncVpf1pQt2pixjypAA8/desktop-support-technician---harlem-in-new-york-at-inspiroz
"100% coverage on employee health, vision and dental insurance, partial coverage for family; Parental leave; NY Commuter benefits; Flexible Spending Accounts (FSA) and Health Savings Account (HSA); Retirement planning (401k); 3 weeks PTO; Team building events outside of the office",,"Long Island City, New York, United States",https://workablehr.s3.amazonaws.com/uploads/account/logo/56260/logo,HistoWiz,http://histowiz.com,Biotechnology,"HistoWiz is the largest online histopathology company based in New York City. Our mission is to help biomedical researchers find cures by accelerating histopathology and enabling global collaboration. We are looking for a Customer Service Associate interested in joining us in our mission and making an impact in the scientific community. Since inception in 2013, we have doubled our month-over-month sales, driven primarily by customer referrals. We are profitable, won numerous awards and are funded by prestigious investors, including Y-Combinator and Zhenfund. We are seasoned scientists with experience at leading academic institutions and have published high impact research in top journals of biomedicine. HistoWiz has over 1, 000 paying customers globally from top academic institutions (e. g. MSKCC, Harvard, Stanford, HHMI) and pharmaceutical companies (e. g. CRISPR, Johnson &amp; Johnson, Regeneron). We process tissue specimens and digitize all of the results, hosting our client’s data on a proprietary platform, PathologyMapTM . This platform not only enables industry-leading turnaround time for diagnosis, but also online viewing, sharing and search. No other platform like this exists, so we are truly building something new that can bridge scientists, doctors, and patients from all over the world to conquer life-threatening diseases collaboratively instead of individually. This online platform also contains the world’s largest collection of pathology data and the first network of top pathologists. If this all interests you and you're looking to join a dynamic team in a role that will involve intensive problem-solving and strong interpersonal and customer service skills, then please apply!Essential Job Functions Provide technical assistance and assist with navigation of the company's platform Work directly with clients to effectively manage their needs and preferences Communicate via telephone and email to address customer issues Obtain and process all client information and transactions Qualifying leads and directing them to the appropriate department Answer client questions or concerns in a timely, informative, and professional manner Calmly handle customer complaints and work to find solutions Seek assistance and report major problems to upper management Compile and update necessary documents, contracts, etc. Perform basic administrative and clerical duties as necessary Exhibit expert knowledge regarding the products and services offered Work according to set standards and operating procedure Train clients on newly released platform features ",Full-time,HistoWiz is the largest online histopathology company based in New York City. Our mission is to help biomedical researchers find cures by accelerating histopathology and enabling global collaboration. We are looking for a Customer Service Associate int...,1736121600,"BA or BS in a scientific or communications-related field; Experience in a customer service, customer success, technical support or similar role; Excellent computer and technology proficiency; Excellent communication skills and work well under pressure; Experience in a CRO or biotech company is desirable; Experience working in a startup is a plus",Technical Support,https://jobs.workable.com/view/eDniFDxcXbs9o1ftFMTjk8/biotech-customer-support-specialist-in-long-island-city-at-histowiz
