benefits,company_description,company_locations,company_logo,company_name,company_website,department,description,employmentType,excerpt,lastUpdated,requirements,title,url
"This is a unique opportunity to work with one of Madison Avenue’s valued clients, a prominent commercial real estate organization. You’ll contribute to innovative projects, tackle real-world challenges, and play a pivotal role in advancing their Salesforce capabilities.; If this sounds like the right fit for you, we’d love to hear from you. Let’s take the next step in your Salesforce career together!",,"New York, New York, United States",,Madison Ave Consulting,http://madisonaveconsulting.com,,"Salesforce Developer – Commercial Real EstateLocation: New York City - HybridSalary: $100, 000. 00 - $125, 000. 00Madison Avenue Consulting is a trusted Salesforce partner dedicated to connecting top talent with organizations that need transformative Salesforce solutions. We are currently seeking a Salesforce Developer for one of our long-standing clients, a prominent commercial real estate organization. This is a full-time role initially requiring regular attendance at the client’s office in New York City during the ramp-up period. This ensures effective knowledge transfer and onboarding. Once these stages are completed, the role can transition to a hybrid model or potentially remote, making it ideal for candidates in the NYC area. About the RoleThis role involves designing and developing custom Salesforce solutions, managing data migration efforts, and collaborating with internal stakeholders to align technical solutions with business goals. In addition, the role requires hands-on Salesforce Administration expertise to support system configuration, maintenance, and optimization. Note: Candidates must be U. S. Citizens or Green Card holders. ",Full-time,"Salesforce Developer – Commercial Real EstateLocation: New York City - HybridSalary: $100,000.00 - $125,000.00Madison Avenue Consulting is a trusted Salesforce partner dedicated to connecting top talent with organizations that need transformative Sales...",1737590400,"Apex Development: Design, develop, and test custom Apex code to enhance platform functionality and address specific business requirements.; Data Management and Migration: Oversee and execute data migrations, ensuring data integrity and smooth transitions between systems.; Salesforce Administration:; Configure and manage Salesforce objects, fields, workflows, validation rules, page layouts, and Lightning Record Pages. Implement and troubleshoot complex flows to support business processes. Manage user permissions, profiles, and data security protocols.; Collaboration: Work closely with admins and internal stakeholders to gather requirements, design scalable solutions, and ensure alignment with business objectives.; System Maintenance: Perform routine system maintenance, resolve technical issues, and ensure optimal platform performance.; Integration Projects: Support future integrations with platforms like Crexi and assist in ensuring seamless functionality across systems. Troubleshooting: Diagnose and resolve platform issues, leveraging best practices to maintain high performance.; Expertise in Apex programming, including triggers, classes, and asynchronous operations.; Familiarity with Lightning Web Components (LWC) and Visualforce.; Experience debugging and enhancing Salesforce functionality using custom code.; Proficiency with Flow Builder, workflows, validation rules, and approval processes.; Expertise in user management, security settings, and data integrity best practices.; Hands-on experience managing Lightning Record Pages and optimizing platform configurations.; Strong knowledge of data migration tools (e.g., Data Loader, Workbench).; Proven experience in managing large-scale data migrations with attention to accuracy and integrity.; Ability to work closely with admins, business users, and other stakeholders to gather requirements and deliver tailored solutions.; Strong communication skills to explain technical concepts to non-technical audiences.; Knowledge of Salesforce best practices to ensure scalable, maintainable solutions.; Minimum 5+ years of Salesforce development and administration experience.; Strong background in Apex, LWC, and data migration efforts.; Proficiency in Salesforce configuration, user management, and platform maintenance.; Experience collaborating with Salesforce admins and stakeholders on internal projects.",Technical Support,https://jobs.workable.com/view/2fNJWEyP6PBPozVeHpFVCN/hybrid-salesforce-developer---commercial-real-estate-in-new-york-at-madison-ave-consulting
"WHAT WE OFFER:; At OrganOx, we value innovation, evidence, integrity, teamwork, respect, and passion. We offer competitive compensation and comprehensive benefits, including healthcare and retirement plans. We support work-life balance and provide opportunities for ongoing professional development.; We are an equal opportunity employer, and all qualified applicants will receive consideration for employment without regard to race, color, religion, age, sex, sexual orientation, gender identity or expression, national origin, disability status, protected veteran status, genetic information, or any other characteristic protected by law.","OrganOx is an innovative, fast-paced, global medical device company with a mission to save lives by making every donated organ count. We are a commercial stage organ technology company, spun out of the University of Oxford in 2008, committed to improving transplantation outcomes throughout the world. The company’s first product, the OrganOx metra® normothermic machine perfusion (NMP) system for liver transplantation, has been used to support more than 4, 000 liver transplant operations globally. ","Madison, New Jersey, United States",https://workablehr.s3.amazonaws.com/uploads/account/logo/665040/logo,OrganOx,https://www.organox.com/,Quality (US),"ABOUT ORGANOX:OrganOx has been transforming organ transplantation since 2008, leveraging groundbreaking normothermic machine perfusion technology in our flagship product, the OrganOx metra®. This technology helps preserve donor livers for up to 12 hours, in efforts to reduce organ discard rates and facilitate more successful transplants. We are an innovative, fast-paced global medical device company committed to improving transplantation outcomes. As part of our ongoing expansion in North America, we seek a motivated Service Quality Engineer to join our team. Position SummaryThe Service Quality Engineer is responsible for the Quality processes within the Service organization, including the Service Depot, Field Service and/or International Service. This individual will be technical, hands-on, and customer focused with an ability to diagnose and test product quality issues. The successful candidate is collaborative, has excellent communication and problem solving skills, and is passionate about delivering world-class products that make healthcare more accessible, simpler, and safer. The Service QE will be responsible to review the output of Servicing and related Complaint Investigation activities to ensure that the resulting work complies with all regulatory and service requirements, as well as facility, divisional, and corporate objectives for defect prevention and continuous improvement. Listed below are the major responsibilities of the role and a brief description of some of the key tasks to be performed. This list is not totally exhaustive. This is an in-office role in our Madison, NJ facility to ensure effective control of the manufacturing and service documentation, and collaboration with both the Operations and Quality teams; this will be agreed with the QC Team Leader or Manager. RequirementsMajor ResponsibilitiesUnder direction from the Service Quality Manager, the Service Quality Engineer will be responsible for: Conduct hands on analyses of serviced products to identify root causes of failures Develop investigation criteria and test methods to properly diagnose and root cause field failures The Service QE will be responsible to review the output of Servicing and related Complaint Investigation activities to ensure that the resulting work complies with all regulatory and service requirements, as well as facility, divisional, and corporate objectives for defect prevention and continuous improvement. Audit and review Complaint Investigations and records of Servicing activities to ensure they are thorough, accurate, self-explanatory, and completed in a timely manner into the complaint handling system. Develop investigation criteria and prior investigation summaries Conduct analyses of serviced products to identify root causes of failures Perform Develop Service-related PFMEAs and other activities to support pre-market and post-market risk management activities Perform Quality trending of Service data and conduct investigations to identify causes of Servicing and Service-related complaint trends, including issues in Servicing workmanship and Out of Box failures. Provide ongoing training to Service staff on regulatory requirements associated with complaint investigations and Servicing records Participate in Product Transfer teams to assist in developing service repair processes for new or transferred products Plan, develop and conduct Service Manual and Service work instruction validations (IQ, OQ, PQ), test method validations, inspection method validations, Participate in the development and review of engineering change orders that impact servicing activities Work with Engineering to design and implement tooling and fixturing required to perform servicing activities and implement error-proofing (Poke-Yoke) in those stations Work cross-functionally to support implementation of changes in servicing and inspection procedures to mitigate field failures. Support CAPAs, Escalations, and engineering projects in response to field quality issues. Perform DHR, Service History record, and PFMEA reviews in support of complaint investigations Adhere to the letter and spirit of OrganOx’s Code of Conduct and all other company policies. While the above key responsibilities are the main elements of the titled job the Vice President Quality may at times request other tasks deemed to be within their capabilities. ",Full-time,"ABOUT ORGANOX:OrganOx has been transforming organ transplantation since 2008, leveraging groundbreaking normothermic machine perfusion technology in our flagship product, the OrganOx&amp;nbsp;metra®. This technology helps preserve donor livers for up t...",1737072000,"Excellent technical report writing skills; Strong Root Cause Analysis, and Design Of Experiments, and test method development /Investigation experience as related to Service activities and complaint investigations; A solid understanding of the FDA QSR Quality System Requirements, and the ability to apply the knowledge to comply with goals and objectives.; Strong experience with MS Office Products (Word, Excel, Visio, Project, PowerPoint, Outlook, etc.); Strong experience with statistical analysis of data. Experience with Minitab preferred.; Experience with Six Sigma principles preferred.; Experience with SolidWorks preferred.; Excellent oral and written communication skills with the ability to communicate with audiences of varying technical skills; A strong ability to prepare written technical plans and reports in support of engineering changes, product or process validations, and failure investigations.; Strong focus on meeting customer needs.; Ability to work with cross-functional teams.; Ability to be self-driven and solve complex problems independently.; Demonstrated strong attention to detail and “do it right the first time” attitude; Bachelor’s degree in an Engineering discipline (Electrical, Mechanical, Bio-Medical, etc.) or the equivalent work experience; 1-3 2-6 years of related quality engineering (QE) work experiencehands on engineering experience in a regulated industry. Experience with medical devices preferred.; Ability to travel 10-20%; Knowledge of electro-mechanical troubleshooting techniques; Experience in a customer focused Service organization is a plus; Familiarity with ISO14971 and associated Risk Management Processes is a plus; Knowledge of and/or experience with product decontamination and Blood Borne Pathogen exposure controls is a plus; Ability to lift, push, or pull up to 50 pounds; Experience in an FDA regulated environment is a plus",Technical Support,https://jobs.workable.com/view/9Cx5PrhqntkeN5UH8Z4gPY/service-quality-engineer-in-madison-at-organox
,"Aon exists to shape decisions for the better — to protect and enrich the lives of people around the world. Our colleagues provide our clients in over 120 countries and sovereignties with advice and solutions that give them the clarity and confidence to make better decisions to protect and grow their business. As an organization, we are united through trust as one inclusive, diverse team, and we are passionate about helping our colleagues and clients succeed. ","Garden City, New York, United States",https://production-job-board-public.s3.amazonaws.com/logos/ba700634-7c50-4c06-9aad-ec7cbfdaa8f8,Aon,https://www.aon.com/unitedkingdom/default.jsp,,"Aon is looking for a Senior Account Executive to join our Travel Practice. This a hybrid role with the flexibility to work both virtually and from our Miami, FL or New York, NY office. Aon Affinity Travel Practice is a leading global provider of customized, revenue-generating travel insurance programs for some of the best-known brands in consumer travel. We collaborate with partners to optimize this important value-added product/service through program development, carrier brokerage, program structure and distribution strategies that meet defined objectives and targets. We apply intelligent analytics, innovative product design, compelling segmentation strategies and engaging creative materials to impact conversion at the point of travel purchase through our partners’ direct and indirect distribution channels. We strive to deliver continuous growth from this important ancillary offer for the benefit of our travel industry partners and their customers, the underwriting insurers with whom we place these programs and our own shareholders. In addition, we service customers (claimants) through our TPA using proprietary and partner systems and processes through our claims center, call center and robust technology platforms. We aim to accelerate process improvement and value delivery though innovation and digitalization initiatives. Aon is in the business of better decisions At Aon, we shape decisions for the better to protect and enrich the lives of people around the world. As an organization, we are united through trust as one inclusive, diverse team, and we are passionate about helping our colleagues and clients succeed. What the day will look likeServe as senior relationship leader for large, multinational enterprise clients to retain, grow and optimize customer Travel Protection programs for Affinity Travel Practice. Demonstrate and apply knowledge of insurance, underwriting and compliance (ideally in Travel and B-to-B-to-C) environments in client program management Understand client objectives (revenue, risk, compliance, distribution and brand differentiation) and collaborate with C-level stakeholders leveraging analytics, marketing, carrier/compliance, Account Teams to deliver differentiated market value to our clients Continuously monitor clients’ performance, company structure, operations, and credit/risk profile in support of the Travel program. This includes reviewing financials and presenting to stakeholders periodically to ensure full visibility into program performance on a regular cadence. Work with client service team to communicate standards and service performance expectations and ensure appropriate training is provided to client and Aon TPA team. Owns delivery of new solutions for clients by reviewing their needs/capabilities and gaps regularly. Drive growth for the organization by working collaboratively with internal sales producers, Aon United colleagues who service other parts of client’s business, the Affinity Travel Account Executives and other team members to bring in new clients or prospects. This includes contributing to the sales process and leveraging learnings across clients. Domestic Travel to client sites required. Skills and experience that will lead to success Knowledge of Insurance structures, underwriting, travel industry, consumer travel distribution channels desired. Knowledge and experience in Travel of at least 5+ yearsExperience in product development, program optimization and merchandising within and across client portfolios to deliver revenue and margin. Ability to work across clients and functions, effectively synthesize information and develop informative and persuasive decks and analyses for executives / clients. Effective relationship builder, understands and finds levers for expansion internally and externally to deepen relationships. Well-developed communication and presentation skills, effective collaborator across stakeholders to optimize opportunities and mitigate risk. Attention to detail and technical proficiency is critical, while maintaining strategic direction on business and client growth in their space Knowledge of Insurance structures, underwriting, travel industry, consumer travel distribution channels desired. Education:Bachelor's Degree with emphasis in business, preferably finance or accounting, or equivalent work experience. How we support our colleagues In addition to our comprehensive benefits package, we encourage a diverse workforce. Plus, our agile, inclusive environment allows you to manage your wellbeing and work/life balance, ensuring you can be your best self at Aon. Furthermore, all colleagues enjoy two “Global Wellbeing Days” each year, encouraging you to take time to focus on yourself. We offer a variety of working style solutions, but we also recognize that flexibility goes beyond just the place of work. .. and we are all for it. We call this Smart Working! Our continuous learning culture inspires and equips you to learn, share and grow, helping you achieve your fullest potential. As a result, at Aon, you are more connected, more relevant, and more valued. Aon values an innovative, diverse workplace where all colleagues feel empowered to be their authentic selves. Aon is proud to be an equal opportunity workplace. Aon provides equal employment opportunities to all employees and applicants for employment without regard to race, color, religion, creed, sex, sexual orientation, gender identity, national origin, age, disability, veteran, marital, domestic partner status, or other legally protected status. People with criminal histories are encouraged to apply. We welcome applications from all and provide individuals with disabilities with reasonable adjustments to participate in the job application, interview process and to perform essential job functions once onboard. If you would like to learn more about the reasonable accommodations we provide, email ReasonableAccommodations@Aon. com For positions in San Francisco and Los Angeles, we will consider for employment qualified applicants with arrest and conviction record in accordance with local Fair Chance ordinances. Nothing in this job description restricts management's right to assign or reassign duties and responsibilities to this job at any time. Pay Transparency Laws The salary range for this position (intended for U. S. applicants) is $130, 000 to $175, 000 annually. The actual salary will vary based on applicant’s education, experience, skills, and abilities, as well as internal equity and alignment with market data. The salary may also be adjusted based on applicant’s geographic location. This position is eligible to participate in one of Aon’s annual incentive plans to receive an annual discretionary bonus in addition to base salary. The amount of any bonus varies and is subject to the terms and conditions of the applicable incentive plan. We offer you Aon offers a comprehensive package of benefits for full-time and regular part-time colleagues, including, but not limited to: a 401(k) savings plan with employer contributions; an employee stock purchase plan; consideration for long-term incentive awards at Aon’s discretion; medical, dental and vision insurance, various types of leaves of absence, paid time off, including 12 paid holidays throughout the calendar year, 15 days of paid vacation per year, paid sick leave as provided under state and local paid sick leave laws, short-term disability and optional long-term disability, health savings account, health care and dependent care reimbursement accounts, employee and dependent life insurance and supplemental life and AD&amp;D insurance; optional personal insurance policies, adoption assistance, tuition assistance, commuter benefits, and an employee assistance program that includes free counseling sessions. Eligibility for benefits is governed by the applicable plan documents and policies. #LI-CC1#LI-HYBRID 2552853",Full-time,"Aon is looking for a Senior Account Executive to join our Travel Practice. This a hybrid role with the flexibility to work both virtually and from our Miami, FL or New York, NY office. Aon Affinity Travel Practice is a leading global provider of custom...",1738195200,,Technical Support,https://jobs.workable.com/view/j1PLTqRrfRqjSJ8XR9MUTc/senior-account-executive%2C-travel-practice-in-garden-city-at-aon
,"DMV IT Service is a leading IT consulting firm specializing in providing strategic technology solutions for corporate enterprises and high-growth organizations. We focus on IT strategy, infrastructure optimization, and digital transformation to help businesses drive efficiency and achieve their goals. Our team thrives on solving complex challenges and delivering impactful results through innovative and scalable solutions. Join us to be part of a dynamic environment where your contributions directly shape the future of businesses. ","New York, New York, United States",https://workablehr.s3.amazonaws.com/uploads/account/logo/681490/logo,DMV IT Service,https://www.dmvitservice.com/,,"Job Title: Sr. Developer Power PlanLocation: New York, NYEmployment Type: Full-TimeAbout Us:DMV IT Service LLC is a trusted IT consulting firm, delivering tailored solutions to businesses and individuals since 2020. We specialize in optimizing IT infrastructure, providing expert guidance, and supporting workforce needs with top-tier staffing services. Our consulting expertise spans system administration, cybersecurity, networking, and IT operations, empowering clients to achieve their technology goals. With a client-focused approach, we also offer online training and job placements to build long-term IT success. Job Overview:We are seeking a seasoned IT professional with extensive experience in the utility industry and a strong background in PowerPlan integration. The ideal candidate will have at least 8 years of experience in the IT industry, with specific skills in technical support, integration, issue analysis, project leadership, and documentation. ",Full-time,"Job Title: Sr. Developer Power PlanLocation: New York, NYEmployment Type: Full-TimeAbout Us:DMV IT Service LLC is a trusted IT consulting firm, delivering tailored solutions to businesses and individuals since 2020. We specialize in optimizing IT infra...",1738108800,"Technical Support and Integration: Demonstrate a strong technical understanding of integration with PowerPlan and comprehensive knowledge of related business processes.; Issue Analysis and Resolution: Conduct thorough analyses of issues, providing accurate and timely solutions. Proactively address routine problems with minimal supervision and escalate complex issues appropriately.; Project Leadership: Collaborate with various IT groups to support server upgrades, Oracle database enhancements, and application fixes, particularly related to the PowerPlan application.; Documentation and Coding: Ensure high-quality code delivery, document all coding changes comprehensively, and provide accurate work estimates for programming tasks.; Must Have:; 3rd Party Software Integration; Oracle 12c; Oracle Applications PL/SQL; Oracle SQL Developer; PowerBuilder Developer; PowerPlan 2021.x; Nice to Have:; Experience with property records and property tax; Utilities industry experience",Technical Support,https://jobs.workable.com/view/2946ZNuKFaUUnyWx42DbF7/sr.-developer-power-plan-in-new-york-at-dmv-it-service
