benefits,company_description,company_locations,company_logo,company_name,company_website,department,description,employmentType,excerpt,lastUpdated,requirements,title,url
"Thorlabs offers a complete benefits package that includes medical, dental and vision insurance, company paid life insurance, a generous PTO package, a 401(k) plan, and tuition reimbursement just to name a few..","Thorlabs Ltd. manufactures Motion Control and Vibration Isolation products for photonics applications in the industrial and research sectors. 12 miles from Cambridge with train and bus linkDouble digit annual growthOur vision and values drive our operations, our interactions, and the traits we look for in new talent:In addition to onsite training, we offer multiple and cross-departmental opportunities for development:External training and funded educationHands-on lab experience across global locationsCareer progression opportunitiesAnnual entity-wide leadership development Contributed Pension Scheme Group Life Cover Private Health Care Child Care Vouchers Group Income Protection and more. If you wish to apply for the above position, please send a copy of your CV along with a covering letter and your salary expectations to: Human Resources at Thorlabs Ltd, 204 Lancaster Way Business Park, Ely, Cambridgeshire, CB6 3NX or email recruitment@thorlabs. comIn line with the requirements of the Immigration, Asylum and Nationality Act 2006, all applicants must have a valid permission to enter or remain in the UK with no condition that prevents them from working in the UK. Documented evidence of such permission will be required from candidates as part of the recruitment process. ","Newton, New Jersey, United States",https://workablehr.s3.amazonaws.com/uploads/account/logo/327786/logo,Thorlabs,https://www.thorlabs.com/,US - Information Technology,"Thorlabs is pleased to play a role in advancing science through the components, instruments, and systems we design and manufacture. We believe that science and innovation have great potential to improve the world around us and are committed to advancing photonics (i. e. , light-based) technologies that positively impact our customers, employees, and communities. Via educational outreach and more sustainable business practices, we continuously invest in a brighter future. We recognize that each of our employees is a unique individual with the ability to contribute to our success and seek to find great people who will thrive in our fun, fast-paced culture. The Information Security Manager (ISM) is responsible for developing, managing, and executing the organization’s Governance, Risk, and Compliance (GRC) initiatives. This role focuses on aligning the organization with regulatory compliance frameworks such as PCI-DSS, CMMC 2. 0, and ISO27001. The ISM drives security best practices, mitigates risks, and ensures adherence to critical industry standards. Although the location of the position is in Newton, NJ, from time to time it may be required to undertake duties at other Thorlabs locations. Essential Job Functions include the following, but are not limited to:Governance and Policy Management Develop, review, and update information security policies, standards, and procedures in line with best practices and regulatory requirements. Ensure compliance with laws, regulations, and standards, including PCI-DSS and CMMC certification. Communicate effectively with stakeholders to address compliance challenges and ensure transparency. Risk Management Define Key Risk Indicators (KRIs) and produce metrics to assess the organization’s security posture. Conduct risk assessments, identify vulnerabilities, and prioritize risk mitigation strategies. Collaborate with IT and business units to integrate risk management practices into daily operations. Compliance Leadership Lead and maintain compliance efforts for PCI-DSS, CMMC, and other regulatory frameworks. Serve as a Subject Matter Expert (SME) for PCI-DSS and CMMC, supporting teams in meeting compliance requirements. Manage relationships with external auditors and oversee certification audits. Incident Management and Response Support incident response efforts by ensuring proper governance, documentation, and adherence to compliance requirements. Provide guidance on compliance and governance implications of security incidents and remediation efforts. Audit and Reporting Coordinate and lead internal audits and manage external audits related to security and compliance programs. Prepare reports and dashboards for executive management, highlighting key metrics on governance, risk, and compliance activities. Organize and provide evidence for third-party audits while ensuring successful responses. The Company retains the right to change or assign other duties to this position. Physical Activities: This is largely a sedentary role; however, it may require the ability to lift, bend or stand as necessary. The employee may occasionally lift or move objects up to 25 pounds. ",Full-time,"Thorlabs is pleased to play a role in advancing science through the components, instruments, and systems we design and manufacture. We believe that science and innovation have great potential to improve the world around us and are committed to advancin...",1738195200,"10+ years of professional experience, including 5+ years in information security with a focus on GRC.; Proven experience with regulatory frameworks (e.g., ISO27001, NIST, CMMC, PCI-DSS, GDPR).; Familiarity with GRC tools (e.g., RSA Archer, ServiceNow GRC).; Experience in cloud security governance for providers like Azure or AWS.; Project management experience, particularly in compliance and audit initiatives.; Bachelor's Degree in Information Security, Computer Science, IT, Business Administration, or a related field (or equivalent experience).; Strong knowledge of risk management methodologies, security frameworks (e.g., NIST 800-53, ISO 27001), and controls.; Hands-on experience with vulnerability management tools (e.g., Qualys, Nessus, Rapid7) and attack surface management solutions is a big plus.; Exceptional communication skills to collaborate effectively with diverse teams and explain complex concepts to non-technical stakeholders.; Expertise in managing internal and external audits for security certifications, including PCI-DSS and CMMC readiness.; Compliance with International Traffic in Arms Regulations (ITAR).",Systems Security Administrator,https://jobs.workable.com/view/7E3MQheJMAkjuRN33sahT6/hybrid-information-security-manager-in-newton-at-thorlabs
"WHAT WE OFFER:; At OrganOx, we value innovation, evidence, integrity, teamwork, respect, and passion. We offer competitive compensation and comprehensive benefits, including healthcare and retirement plans. We support work-life balance and provide opportunities for ongoing professional development.; We are an equal opportunity employer, and all qualified applicants will receive consideration for employment without regard to race, color, religion, age, sex, sexual orientation, gender identity or expression, national origin, disability status, protected veteran status, genetic information, or any other characteristic protected by law.","OrganOx is an innovative, fast-paced, global medical device company with a mission to save lives by making every donated organ count. We are a commercial stage organ technology company, spun out of the University of Oxford in 2008, committed to improving transplantation outcomes throughout the world. The company’s first product, the OrganOx metra® normothermic machine perfusion (NMP) system for liver transplantation, has been used to support more than 4, 000 liver transplant operations globally. ","Madison, New Jersey, United States",https://workablehr.s3.amazonaws.com/uploads/account/logo/665040/logo,OrganOx,https://www.organox.com/,IT (US) O00003,"ABOUT ORGANOX:OrganOx has been transforming organ transplantation since 2008, leveraging groundbreaking normothermic machine perfusion technology in our flagship product, the OrganOx metra®. This technology helps preserve donor livers for up to 12 hours, in efforts to reduce organ discard rates and facilitate more successful transplants. We are an innovative, fast-paced global medical device company committed to improving transplantation outcomes. As part of our ongoing expansion in North America, we seek a motivated IT / Cybersecurity professional to join our team. Position SummaryWe are thrilled to offer a compelling opportunity for a qualified candidate to join our team at OrganOx, based in Madison, NJ. As the Infrastructure and Cybersecurity Engineer, you will play a crucial role in ensuring the smooth operation and security of our IT systems, providing technical assistance to our staff both within the Madison office, across the United States and Europe. We are seeking a flexible and innovative team player with a positive attitude and a hands-on approach who has a strong understanding of computer systems, networks, and security. This role requires a mix of strategic, technical and people skills to help OrganOx deliver positive impact to many patient’s lives. ",Full-time,"ABOUT ORGANOX:OrganOx has been transforming organ transplantation since 2008, leveraging groundbreaking normothermic machine perfusion technology in our flagship product, the OrganOx metra®. This technology helps preserve donor livers for up to 12 hour...",1730419200,"Help design, implement, and maintain IT infrastructure, including networks and cloud systems.; Monitor systems to ensure uptime, performance, and availability.; Support day-to-day IT operations, troubleshooting hardware and software issues.; Assist in backup, recovery, and disaster recovery processes.; Cybersecurity:; Implement security measures to protect data and IT systems.; Assist with regular security audits, vulnerability assessments, and patch management.; Monitor for security threats and respond to incidents.; Ensure compliance with healthcare regulations like HIPAA and FDA.; Adhere to the letter and spirit of OrganOx’s Code of Conduct and all other company policies; Work with cross-functional teams, including product development, to support IT needs.; Provide technical support and guidance to team members on IT security and best practices.; Proficient in server and network management, including Windows/Linux and Cisco environments.; Experience with cloud services such as AWS and Azure, along with virtualization technologies like VMware and Hyper-V.; Familiar with cybersecurity solutions, including firewalls, intrusion detection systems, and endpoint protection.; Comprehension of regulatory compliance requirements, such as HIPAA and FDA, as they pertain to IT systems.; Skilled in conveying technical challenges to non-technical audiences.; A collaborative team member who works well across various departments.; Over 3 years of experience in IT infrastructure and cybersecurity.; Certifications such as CompTIA Security+, CCNA, Microsoft Azure, or equivalent are advantageous.; Experience in the healthcare sector or other regulated industries is preferred.; Capable of lifting, pushing, and pulling weights of up to 50 pounds.; Willing to work in-office on a hybrid schedule and available to attend in person as required.",Systems Security Administrator,https://jobs.workable.com/view/1yrVxko9ABvUoJmwdWVnmS/it-%2F-cybersecurity-engineer-in-madison-at-organox
"What We Offer; The EarthCam package includes excellent salaries, bonuses, benefits, and constant opportunities for development – designed to create an entrepreneurial, invigorating and satisfying environment. Our benefits include:; ·         Health insurance (Single coverage 100% paid for by company); ·         Dental and vision insurance; ·         401K Plan (with aggressive company matching); ·         Paid time off, plus paid holidays; ·         Regular free breakfasts, lunches and snacks; ·         Bicycles to ride around campus; ·         Team BBQs and annual company Olympics",,"Upper Saddle River, New Jersey, United States",,EarthCam,https://www.earthcam.com,Cybersecurity,"Who We AreEarthCam is the global leader in providing webcam content, technology and services. Founded in 1996, EarthCam provides live-streaming video, time-lapse construction cameras, and Software-as-a-Service (SaaS) for AI-powered visual asset management, leveraged through our intuitive Control Center 8 dashboard which integrates with leading project management software. EarthCam leads the industry with the highest resolution imagery available, to empower building information modelling (BIM) and Virtual Design Construction (VDC) teams with actionable visual data. EarthCam's innovations include the world’s first outdoor gigapixel panorama camera system, and the first ever 5G construction camera. EarthCam has documented over a trillion dollars of construction projects around the world. The company is headquartered on a 10-acre campus in northern New Jersey. We are currently seeking a dedicated and diligent Vulnerability Analyst to join our growing team. Responsibilities· Monitor and analyze security events and incidents using various security tools and technologies. · Assist in developing and implementing security policies, procedures, and standards· Respond to security incidents and provide detailed analysis and reports· Collaborate with IT and other departments to ensure security measures are integrated into all systems and processes· Maintain up-to-date knowledge of cybersecurity trends, threats, and technologies· Participate in security awareness training and education programs for employees· Assist in the preparation and maintenance of documentation for compliance with security standards and regulations (e. g. , NIST, SOC 2, ISO 27001)· Perform Internal Risk assessments and Audits· Conduct regular vulnerability assessments and penetration testing",Full-time,"Who We AreEarthCam is the global leader in providing webcam content, technology and services. Founded in 1996, EarthCam provides live-streaming video, time-lapse construction cameras, and Software-as-a-Service (SaaS) for AI-powered visual asset managem...",1730764800,"Who YOU are; ·         Strong communicator; ·         A critical thinker; ·         Adaptable; ·         Responsive; ·         Passionate about cybersecurity; Qualifications; ·         Bachelor’s degree in Information Security, Computer Science, or a related field.; ·         3-5 years of experience in information security or a related role; ·         Familiarity with security frameworks and standards (e.g., NIST, ISO 27001); ·         Experience with security tools such as SIEM, IDS/IPS, vulnerability scanners, and endpoint protection; ·         Understanding of application and network security principles and practices; ·         Relevant certifications (e.g., CompTIA Security+, CISSP, CEH) is a plus; ·         Experience with cloud security (e.g., AWS, Azure) is a plus; ·         Knowledge of scripting languages (e.g., Python, PowerShell) for automation is a plus",Systems Security Administrator,https://jobs.workable.com/view/pmYX8d2Ns7QwiTmvuVx22y/vulnerability-analyst-in-upper-saddle-river-at-earthcam
,,"Chester, New York, United States",https://workablehr.s3.amazonaws.com/uploads/account/logo/197306/logo,Pierce Technology Corp,http://www.pierce.com,Mediacom," Design, implement, and manage complex network architecture to meet requirements from various business units Support network and security infrastructure and controls, including, but not limited to Routers, Switches, SD-WAN, Firewalls, VPN, TACACS, netflow based tools, etc. Develop and implement disaster recovery plans for the network; assist in conducting periodic internal and external audits to assess security/risk in the network Ensure network systems comply with relevant regulatory and compliance standards Participate in incident triage, analysis, response, and remediation for network outages, intrusions, attacks, and other incidents Assist in developing network-specific security policies, guidelines, standards, and procedures Implement automation scripts and tools to streamline repetitive network tasks Manage network services and configurations, recommending and implementing changes that will improve overall company network security Assist in evaluating and developing solutions for complex network and security technologies for enterprise and service provider environments Work with network hardware and software vendors to evaluate new products and technologies Lead and/or participate in network-related projects, ensuring timely and successful completion. Collaborate with cross-functional teams to understand business needs and translate them into effective network solutions; collaborate with IT to design and implement hybrid cloud network solutions ",Full-time," Design, implement, and manage complex network architecture to meet requirements from various business units Support network and security infrastructure and controls, including, but not limited to Routers, Switches, SD-WAN, Firewalls, VPN, TACACS, netf...",1730937600,"5 to 7 years of technical hands-on networking and security experience; A solid background in network administration and architecture, and an in-depth understanding of communication protocols and routing protocols (e.g., BGP, OSPF); Strong understanding of network security principles and best practices; Familiarity with access control models and network security, knowledge of coding languages for scripting (e.g., Python); Experience with network diagnostic, monitoring, and analysis tools; Experience with routers, switches, firewalls, VPN, netflow, and other network security tools; Strong analytical and problem-solving skills with an ability to assimilate, analyze, and correlate large amounts of forensic data from various network, operating system, application, and security devices, logs, and alerts; Experience in handling networking and security for a large enterprise network or service provider network; Ability to present and communicate clearly with technical and non-technical staff as well as senior management; Strong interpersonal and communication skills",Systems Security Administrator,https://jobs.workable.com/view/tkDuozPsEMifRdwTSdk4sG/network-security-engineer-in-chester-at-pierce-technology-corp
Paid Time Off; Paid Holidays; 401k Safe Harbor Match,,"Neptune Township, New Jersey, United States",,EasTec Inc,http://eastec.com,,"We are seeking a highly organized and communicative Internal Operations Coordinator to streamline our project management processes and improve interdepartmental coordination. This role will serve as the critical link between our field operations, service department, and warehouse/purchasing functions, ensuring smooth information flow and efficient project execution. Key Responsibilities: Act as the primary point of contact for internal communication between field operations, service coordination, and warehouse/purchasing departments. Collaborate closely with the Field Project Manager to understand project requirements and timelines, translating field needs into actionable tasks for other departments. Coordinate with the Service Coordinator to ensure service requests are properly integrated into ongoing project schedules and resource allocations. Liaise with the warehouse/purchasing team to ensure timely procurement and delivery of materials for projects and service calls. Leveraging existing centralized project tracking system, ensuring all departments have access to up-to-date information. (We primarily use Quickbase) Facilitate regular cross-departmental meetings to discuss project statuses, upcoming needs, and potential issues. Continually improve communication protocols to improve information sharing across departments. Review regularly generated reports on project statuses, resource utilization, and interdepartmental performance metrics. Identify bottlenecks in communication or processes and propose solutions to improve operational efficiency. Assist in the maintenance of project documentation, including schedules, change orders, and closeout procedures. Preferred Qualifications: Knowledge of access control, video surveillance, and intrusion detection systems Bachelor's degree in Business Administration, Operations Management, or related field Experience with Quickbase ",Full-time,"We are seeking a highly organized and communicative Internal Operations Coordinator to streamline our project management processes and improve interdepartmental coordination. This role will serve as the critical link between our field operations, servi...",1730246400,"3+ years of experience in project coordination or operations management, preferably in the security integration industry; Strong understanding of project management principles and practices; Excellent communication and interpersonal skills; Proficiency in project management software and Microsoft Office suite; Demonstrated ability to manage multiple priorities and deadlines; Strong problem-solving and analytical skills; Experience with ERP or CRM systems; Familiarity with inventory management and purchasing processes",Systems Security Administrator,https://jobs.workable.com/view/kjHdfFBYhVP12f1h8ZkiwW/internal-operations-coordinator-in-neptune-township-at-eastec-inc
"Salary range for this position is $50,000 to $70,000 per year.; Holiday pay; Ample PTO; Educational incentives; Health Insurance; Dental/Vision Plan","GEM Technologies is a NYC based technology consulting firm and MSP. We leverage our partnership with large, mainstream companies (like Microsoft, VMware, Citrix, and more) to develop and integrate custom on-premise and cloud based solutions for our customers. We also manage and maintain these solutions for our clients after the initial implementation is completed. Our customer service is top of the line and our customers know this! So, we've been growing and now we are seeking top-notch people to join our team! Are you up to the challenge? If so, submit your information and resume using this page and someone will be in touch with you. ","New York, New York, United States",https://workablehr.s3.amazonaws.com/uploads/account/logo/112611/ShareFileLogo.jpg,GEM Technologies,http://www.gemtechnologies.net,New York,"GEM Technologies is a leading Managed Service Provider (MSP) headquartered in the heart of New York City. With a commitment to delivering exceptional IT solutions and services, we serve a diverse range of clients across various industries. Our team of skilled professionals is dedicated to providing top-notch technology solutions that empower businesses to thrive in today's dynamic and ever-evolving digital landscape. We actively monitor, maintain, and fortify clients' digital infrastructures, ensuring robust cybersecurity through continuous threat detection, prevention, and remediation efforts. We are seeking a talented and motivated System Engineer to join our dynamic team of IT experts. As a System Engineer at GEM Technologies, you will work closely with our clients to understand their unique technology needs and collaborate with our team to deliver tailored solutions that drive business success. Your work will be primarily done onsite at client locations throughout the NYC metro area. Key responsibilities will include:- Manage complex IT systems and infrastructure for our clients. - Collaborate with clients to assess their IT requirements and provide expert recommendations. - Implement and support server environments, network configurations, and virtualization technologies. - Troubleshoot and resolve technical issues related to systems, networks, and applications. - Perform regular system updates, maintenance tasks, and security patches. - Monitor system performance, identify areas for improvement, and optimize system efficiency. - Provide exceptional customer service by addressing client inquiries and concerns. - Document system configurations, processes, and procedures. ",Full-time,"GEM Technologies is a leading Managed Service Provider (MSP) headquartered in the heart of New York City. With a commitment to delivering exceptional IT solutions and services, we serve a diverse range of clients across various industries. Our team of ...",1737244800,"- Bachelor's degree in computer science, Information Technology, or related field (or equivalent work experience).; - Proven experience as a System Engineer, Systems Administrator, or similar role.; - Proficiency in managing Windows server environments.; - Strong knowledge of network protocols, firewall configurations, and security best practices.; - Expertise in MDM solutions such as Intune.; - Experience with virtualization technologies such as VMware or Hyper-V.; - Familiarity with cloud platforms such as AWS, Azure, or Google Cloud is a plus.; - Excellent problem-solving skills and a proactive approach to identifying and resolving issues.; - Strong communication skills and the ability to work collaboratively within a team and with clients.; - Relevant certifications (e.g., Microsoft, Cisco, CompTIA) are a plus.; If you are passionate about technology, dedicated to delivering outstanding solutions, and thrive in a fast-paced environment, we want to hear from you! Please submit your resume and a cover letter detailing your relevant experience and why you are a great fit for the System Engineer position at GEM Technologies.",Systems Security Administrator,https://jobs.workable.com/view/m1PCLqLbaQcXaGp7JFnM5R/hybrid-systems-engineer-in-new-york-at-gem-technologies
