benefits,company_description,company_locations,company_logo,company_name,company_website,department,description,employmentType,excerpt,lastUpdated,requirements,title,url
,"DMV IT Service is a leading IT consulting firm specializing in providing strategic technology solutions for corporate enterprises and high-growth organizations. We focus on IT strategy, infrastructure optimization, and digital transformation to help businesses drive efficiency and achieve their goals. Our team thrives on solving complex challenges and delivering impactful results through innovative and scalable solutions. Join us to be part of a dynamic environment where your contributions directly shape the future of businesses. ","New York, New York, United States",https://workablehr.s3.amazonaws.com/uploads/account/logo/681490/logo,DMV IT Service,https://www.dmvitservice.com/,,"Job Title: Sr. Developer Power PlanLocation: New York, NYEmployment Type: Full-TimeAbout Us:DMV IT Service LLC is a trusted IT consulting firm, delivering tailored solutions to businesses and individuals since 2020. We specialize in optimizing IT infrastructure, providing expert guidance, and supporting workforce needs with top-tier staffing services. Our consulting expertise spans system administration, cybersecurity, networking, and IT operations, empowering clients to achieve their technology goals. With a client-focused approach, we also offer online training and job placements to build long-term IT success. Job Overview:We are seeking a seasoned IT professional with extensive experience in the utility industry and a strong background in PowerPlan integration. The ideal candidate will have at least 8 years of experience in the IT industry, with specific skills in technical support, integration, issue analysis, project leadership, and documentation. ",Full-time,"Job Title: Sr. Developer Power PlanLocation: New York, NYEmployment Type: Full-TimeAbout Us:DMV IT Service LLC is a trusted IT consulting firm, delivering tailored solutions to businesses and individuals since 2020. We specialize in optimizing IT infra...",1738108800,"Technical Support and Integration: Demonstrate a strong technical understanding of integration with PowerPlan and comprehensive knowledge of related business processes.; Issue Analysis and Resolution: Conduct thorough analyses of issues, providing accurate and timely solutions. Proactively address routine problems with minimal supervision and escalate complex issues appropriately.; Project Leadership: Collaborate with various IT groups to support server upgrades, Oracle database enhancements, and application fixes, particularly related to the PowerPlan application.; Documentation and Coding: Ensure high-quality code delivery, document all coding changes comprehensively, and provide accurate work estimates for programming tasks.; Must Have:; 3rd Party Software Integration; Oracle 12c; Oracle Applications PL/SQL; Oracle SQL Developer; PowerBuilder Developer; PowerPlan 2021.x; Nice to Have:; Experience with property records and property tax; Utilities industry experience",Technical Support,https://jobs.workable.com/view/2946ZNuKFaUUnyWx42DbF7/sr.-developer-power-plan-in-new-york-at-dmv-it-service
,"Human answers to business questions - Just Sago. Sago, formerly Schlesinger Group, is the global research and data partner that connects human answers to business questions. Combining our legacy of impact, global reach, and innovative spirit, we enable our clients to solve business problems through extensive audience access and an adaptive range of qualitative and quantitative solutions. We help our clients understand what their customers want and demand — empowering them to make decisions with confidence. As a partner to our clients, their clients, and the industry, Sago seamlessly connects businesses to key insights. ","TELECOMMUTE; New Jersey, United States",https://workablehr.s3.amazonaws.com/uploads/account/logo/524485/logo,Sago,https://sago.com/en/,Recruiting Operations,"POSITION SUMMARY: The primary function of this role is to provide technical support and troubleshooting assistance to customers while hosting live online focus groups and provide high quality product support to our end users via tickets, email, chat, and phone. KEY JOB RESPONSIBILITIES: Independently host online focus group sessions, running on the QualMeeting and QualBoard platform while actively listening and watching each session to provide technical support as needed, aiming for the highest quality experience for our clients and participants. Responsible for promptly answering requests via tickets, chats, emails, and phone, providing exceptional customer service. Perform tasks related to a variety of QualProduct setup and deliverables, including, but not limited to, technical check status, updating session statues, and updating stimuli. Help keep clients and projects organized, documented and on schedule. Ability to anticipate, recognize and resolve technical (hardware, software, application or operational) problems. Ability to handle and resolve customer complaints or issues efficiently. Identify and document product failures. Proactively contribute to departmental process improvement, while maintaining platform proficiency by attending all QualProduct trainings and assisting with certain projects including, video upload, project set up and data manipulation using Excel. Any other duties assigned by management. ",Part-time,"POSITION SUMMARY:&amp;nbsp;The primary function of this role is to provide technical support and troubleshooting assistance to customers while hosting live online focus groups and provide high quality product support to our end users via tickets, email...",1737590400,"Strong technical abilities using a variety of web-based applications, ability to learn new platforms with minimal training and to help others learn new platforms as needed.; Service-oriented - perceptive to others’ needs and naturally inclined to help people, treats co-workers and employees with courteousness, consideration, and tact.; Experience with multiple Desktop and Laptop configurations and environments.; Effectively and efficiently communicate information with internal team and customers.; Ability to work effectively as part of a team - cooperative, flexible, reliable, able to express opinions honestly and constructively.; Multi-tasker - able to juggle multiple tasks/projects at a time with high accuracy, high efficiency, and minimal stress.; Extremely detail-oriented - notices incomplete or incorrect information and strives to ensure everything is accurate; able to focus on details while keeping sight of the big picture.; High School Diploma; Minimum 1 year experience working in a technical support or customer service capacity.; Excellent software skills used to support our clients, employees, and project teams (Excel, Microsoft Office Suite and/or Google Equivalents)",Technical Support,https://jobs.workable.com/view/gDNPhK3fMBJtGTCcWAMV2R/remote-online-focus-group-host---part-time-in-new-jersey-at-sago
A company focused on maintaining a great company culture; An opportunity to make a difference in the company and to be rewarded for doing so; A company that is always looking to improve while adhering to our core principles.; An opportunity for career growth within the organization; Competitive compensation package with variable pay potential and benefits,"Since 2012, we have helped more than 200 charter schools with all things technology. We are passionate about helping schools and kids succeed. ","New York, New York, United States",https://workablehr.s3.amazonaws.com/uploads/account/logo/652659/logo,Inspiroz,http://inspiroz.com,On-site Technicians,"Inspiroz is seeking a driven, detail-oriented School Technology Specialist (STS) to join our on-site IT support team in Harlem, NY. As an STS, you will play a crucial role in supporting the day-to-day technology support across Inspiroz’ portfolio of charter schools. Working under the supervision of an Inspiroz Service Delivery Manager, you will interact regularly with our remote technical support team and various client contacts. For over a decade, Inspiroz has established a reputation in the Managed IT Services industry as a premier provider of charter school focused technology strategy and support. Take the next step in your IT career, and apply today! Key responsibilities for this position include the following: Technical support and problem resolution Take the lead in resolving technical issues that require on-site support. Manage on-site installation, repairs, and maintenance for workstations, network equipment and peripheral devices. Conduct thorough troubleshooting to identify the root cause of problems. Assist with projects on an as-needed basis, collaborating with project teams and stakeholders as required. Act as the liaison between on-site operations and the remote IT support team in India. Communicate technical issues and requirements to the remote team accurately and clearly. Provide detailed information and documentation to facilitate remote troubleshooting and support. Works closely with the remote service desk team to resolve technical issues. Stay up-to-date with the latest technology trends, advancements, and best practices in the education sector. Customer support and service Communicates updates, challenges, and tasks to the client in a clear and timely manner. Listens actively to client concerns and addresses them appropriately. Establishes and maintains strong relationships with clients, fostering a sense of trust and partnership. Assists clients in aligning technology solutions with their specific goals and requirements. Ensures client satisfaction by following up on issue resolution and providing necessary support. Takes personal interest in the quality of work and meeting customer needs. Demonstrates professionalism and clarity in written communication, ensuring accuracy and attention to detail in all email interactions. Responds to emails within two hours during business hours and ensures timely responses to after-hours emails or requests, as per the company's communication policy. ’ Time Entry and Ticket Management Accurately and diligently tracks time spent on-site using ConnectWise Manage's time entry feature. Regularly updates ticket statuses and provides clear and concise notes for effective communication and collaboration. Follows the company's established workflow procedures, including ticket creation, assignment, and resolution processes in ConnectWise Manage. Conducts a thorough review of assigned tickets for the next day before the end of the current shift to prepare effectively. ",Full-time,"Inspiroz is seeking a driven, detail-oriented School Technology Specialist (STS) to join our on-site IT support team in Harlem, NY.&amp;nbsp;&amp;nbsp;As an STS, you will play a crucial role in supporting the day-to-day technology support across Inspir...",1736812800,"Windows Systems; Mac Systems; Active Directory; Networking equipment and concepts; Hardware repairs and installations; Excellent customer service skills; Excellent hands-on technical support skills; Excellent verbal and written communication skills; Ability to demonstrate passion for technology, innovation, troubleshooting, and making a difference.; Ability to adapt to changing situations, be flexible in approach, and effectively multitask.; Ability to self-motivate and work independently when required, taking initiative and ownership of tasks.; Ability to assess own limitations, recognize when to ask for help, and effectively collaborate with others.",Technical Support,https://jobs.workable.com/view/iRJncVpf1pQt2pixjypAA8/desktop-support-technician---harlem-in-new-york-at-inspiroz
"100% coverage on employee health, vision and dental insurance, partial coverage for family; Parental leave; NY Commuter benefits; Flexible Spending Accounts (FSA) and Health Savings Account (HSA); Retirement planning (401k); 3 weeks PTO; Team building events outside of the office",,"Long Island City, New York, United States",https://workablehr.s3.amazonaws.com/uploads/account/logo/56260/logo,HistoWiz,http://histowiz.com,Biotechnology,"HistoWiz is the largest online histopathology company based in New York City. Our mission is to help biomedical researchers find cures by accelerating histopathology and enabling global collaboration. We are looking for a Customer Service Associate interested in joining us in our mission and making an impact in the scientific community. Since inception in 2013, we have doubled our month-over-month sales, driven primarily by customer referrals. We are profitable, won numerous awards and are funded by prestigious investors, including Y-Combinator and Zhenfund. We are seasoned scientists with experience at leading academic institutions and have published high impact research in top journals of biomedicine. HistoWiz has over 1, 000 paying customers globally from top academic institutions (e. g. MSKCC, Harvard, Stanford, HHMI) and pharmaceutical companies (e. g. CRISPR, Johnson &amp; Johnson, Regeneron). We process tissue specimens and digitize all of the results, hosting our client’s data on a proprietary platform, PathologyMapTM . This platform not only enables industry-leading turnaround time for diagnosis, but also online viewing, sharing and search. No other platform like this exists, so we are truly building something new that can bridge scientists, doctors, and patients from all over the world to conquer life-threatening diseases collaboratively instead of individually. This online platform also contains the world’s largest collection of pathology data and the first network of top pathologists. If this all interests you and you're looking to join a dynamic team in a role that will involve intensive problem-solving and strong interpersonal and customer service skills, then please apply!Essential Job Functions Provide technical assistance and assist with navigation of the company's platform Work directly with clients to effectively manage their needs and preferences Communicate via telephone and email to address customer issues Obtain and process all client information and transactions Qualifying leads and directing them to the appropriate department Answer client questions or concerns in a timely, informative, and professional manner Calmly handle customer complaints and work to find solutions Seek assistance and report major problems to upper management Compile and update necessary documents, contracts, etc. Perform basic administrative and clerical duties as necessary Exhibit expert knowledge regarding the products and services offered Work according to set standards and operating procedure Train clients on newly released platform features ",Full-time,HistoWiz is the largest online histopathology company based in New York City. Our mission is to help biomedical researchers find cures by accelerating histopathology and enabling global collaboration. We are looking for a Customer Service Associate int...,1736121600,"BA or BS in a scientific or communications-related field; Experience in a customer service, customer success, technical support or similar role; Excellent computer and technology proficiency; Excellent communication skills and work well under pressure; Experience in a CRO or biotech company is desirable; Experience working in a startup is a plus",Technical Support,https://jobs.workable.com/view/eDniFDxcXbs9o1ftFMTjk8/biotech-customer-support-specialist-in-long-island-city-at-histowiz
"Health Insurance, Vision Plan, and Dental Cover for you and your dependants; HSA &amp; FSA; Employee Assistance Programme; Health Advocate, Talk Space, One Medical, Teladoc; 401(k); Commuter benefits; Remote Hybrid Working; Enhanced Parental Leave; Life and AD&amp;D Insurance; 20 Days Holiday + Public Holidays + 3 days paid volunteering leave; Referral Bonus; Buy and Sell Holiday; Training Reimbursement","Through its complete end-to-end monitoring platform, ITRS drives real-time observability for the entire IT environment. We give customers the ability to use technology to drive business performance and provide better outcomes. ","New York, New York, United States",https://workablehr.s3.amazonaws.com/uploads/account/logo/598925/logo,ITRS,https://www.itrsgroup.com/,Sales Engineering Financial Services,"About ITRSRecognized as a Great Place to Work, ITRS is an Enterprise SaaS provider with industry-leading solutions. Our prestigious customer base includes 90% of the world's top investment banks. We are backed by leading private equity investors and are rapidly growing. Our headquarters are in Shoreditch - London's tech hub – with offices in other UK and global locations from the Netherlands to Manila, NYC and Florida. We pride ourselves on a diverse, friendly, dynamic culture - with a focus on internal promotion and developing our people. Scope of RoleITRS Group are looking for an experienced Presales Consultant for the team. You will help accelerate our sales initiatives. As part of the Presales team, you will live and work in the world between Sales, Marketing, Product and Engineering to help our Sales Executives exceed annual sales targets. Our salary offer is in the range of $140, 000 - $170, 000 per year. Reporting to our Global Head of Presales, you will provide technical presentations and product demonstrations to prospective clients, leading technical workshops to help build and define requirements and implementing our solutions as part of Proof of Concepts. As a Presales Consultant, you will: Achieve detailed understanding of all our products and technologies. Lead presentations, demonstrations and conversations with CXO-level and VP-level audiences within major enterprise accounts and prospects. Understand our client requirements, analyze and translate them into a practical solution. Assist the sales team throughout the entire sales cycle as a product and technology expert. Accomplish Proof of Concept to obtain client confidence and acceptance. Coordinate logistics across all partners. Provide professional responses to customer RFPs / RFIs. Position the technology against competitive offerings. Represent the products, company values and brand to customers and at field events such as conferences, seminars. Suggest creative alternatives to address or overcome technical challenges encountered in the sales case. Conduct Technical Account Management (TAM) activities for the main accounts. Fulfill ad-hoc customers and sales requests. Travel regionally for client meetings, marketing events, proof of concepts. Develop an understanding of the competitive landscape in the areas we dissect. Become a trusted advisor for ITRS products related advice. ",Full-time,"About ITRSRecognized as a Great Place to Work, ITRS is an Enterprise SaaS provider with industry-leading solutions. Our prestigious customer base includes 90% of the world&#39;s top investment banks. We are backed by leading private equity investors an...",1738195200,"Minimum of 3 years of working experience as a Presales or Sales Engineering role.; Minimum of 1 year of working experience in Application Performance Management (APM) and AIOps.; Experience using or administering an APM tool like ITRS Geneos, ITRS OP5 Monitor, AppDynamics, Dynatrace or Nagios.; Knowledge and experiences in Capacity Management, Digital Experience Monitoring, ELK, Cloud or Microservices domains will be an advantage.; Experience in application support in Financial Market will be an advantage.; Linux and Windows Administration knowledge or experience to perform software installations and technical issue troubleshooting.; Programming and scripting experience i.e. Shell script, Python, Java.; Basic network knowledge.; Basic database knowledge and query languages.; A highly motivated self-sufficient worker that is also comfortable being part of a regional and global team building complex sales cycles.; Experience establishing communication and engagement with prospects.; Professional technical writing skills.; Well-spoken and business fluency in English. Speaking Mandarin and other Asian languages will be a benefit.",Technical Support,https://jobs.workable.com/view/ukzcz3uTrvzoYYmQbQzY83/hybrid-presales-consultant-in-new-york-at-itrs
"Comprehensive medical, dental, and vision insurance; 401K, matching up to 4% of your salary; Parental Leave Policy; Unlimited vacation days; Sick days; Stock options; Health and Wellness Benefits",,"New York, New York, United States",https://workablehr.s3.amazonaws.com/uploads/account/logo/519534/logo,Carbyne,http://carbyne.com,Operations,"Location: New York, NY (3-days in-office)Who We Are:Hi! We’re Carbyne and we are on a mission to help Public Safety Agencies save lives every day. As the leader in emergency collaboration technologies, we’re building a platform that brings operational improvement and game-changing capabilities to people in crisis, such as live video, instant chat, and location tracking. Our platform unifies the flow of life-saving information to emergency call centers, so they can handle emergencies faster than ever, and get to the right people, in the right place, at the right time. We currently provide services to over 400 million people in over eight countries worldwide, and partner with Amazon, Microsoft, AT&amp;T and others to deliver life-saving technologies. Want to join our mission-driven team? Read on. Headquarters: New York City, New YorkCurrent Headcount: 200 People and counting…Carbyne WebsiteRecent PressTechcrunch article: Carbyne raises $56M Series CAbout the role: We seek an innovative Director of Customer Services to join our mission-driven team and spearhead efforts to elevate Carbyne’s customer experience to new heights. In this role, you will oversee a diverse global team, develop cutting-edge support strategies, and ensure seamless service delivery for public safety agencies relying on Carbyne’s technologies. If you’re a proactive, results-oriented leader with a strong technical background and a passion for solving complex challenges, this role is for you. Here’s what you’ll be working on: Technical Leadership- Guide and mentor a global customer support team, offering strategic direction and hands-on technical expertise to boost performance and achieve key performance indicators (KPIs). Strategic Planning- Develop and execute scalable roadmaps to meet customer and business goals, focusing on innovation, efficiency, and long-term growth. KPI and Goals Management - Define, track, and optimize key performance indicators (KPIs) and departmental goals to ensure alignment with business objectives and drive measurable success. Process Optimization- Architect and implement advanced support methodologies and technologies to enhance customer satisfaction (CSAT/NPS), reduce resolution times, and improve team productivity. Cross-Functional Alignment- Drive collaboration with R&amp;D, Network Operations Center (NOC), and product teams to resolve complex issues and ensure seamless solutions. Data-Driven Insights- Leverage analytics to identify trends, optimize performance, and provide actionable recommendations to senior leadership. Service Reliability- Define and uphold rigorous SLAs, ensuring reliability and exceeding service expectations through proactive strategies. Crisis Management- Act as a key escalation point for critical issues, applying deep technical expertise to resolve high-priority challenges effectively. Customer Advocacy- Champion the customer’s voice in organizational strategy and product development, driving a customer-centric approach. Innovation- Lead the adoption of AI-driven tools and proactive monitoring solutions to anticipate and prevent customer issues, positioning support as a strategic advantage. ",,"Location: New York, NY (3-days in-office)Who We Are:Hi! We’re Carbyne and we are on a mission to help Public Safety Agencies save lives every day. As the leader in emergency collaboration technologies, we’re building a platform that brings operational ...",1736985600,"Experience: 9+ years in customer support or technical operations, with at least 5 years in a senior SaaS leadership role, managing global teams and achieving impactful results.; Technical Proficiency: Must have - extensive hands-on expertise in SaaS, cloud computing (AWS), network services, contact center technologies, and advanced monitoring tools.; Leadership: Proven ability to lead and mentor global teams, foster a collaborative, high-performing culture, and develop a talent pipeline for long-term success.; Customer-Centric Strategy: Successfully align operations with customer needs by developing SLAs, KPIs, and proactive monitoring systems to exceed expectations.; Problem Solving: Strong analytical skills and a hands-on approach to resolving complex challenges, leading crisis responses, and ensuring rapid resolutions.; Strategic Thinking: Expertise in crafting and executing long-term support strategies, leveraging data insights to identify trends, forecast needs, and drive operational improvements.; Global Collaboration: Skilled in managing distributed teams across regions and time zones, ensuring 24/7 operations and alignment with organizational goals through cross-functional partnerships.; Innovation: Demonstrated success in driving change through AI-driven solutions, predictive analytics, and adoption of advanced systems to enhance customer support processes; Customer Advocacy: Effectively represents the customer’s voice in product development and strategic planning, driving customer-centric outcomes and operational excellence.; Travel: Ability and willingness to travel up to 25% as required.",Technical Support,https://jobs.workable.com/view/nSL3TnDD92DaQF9CcwEjtK/hybrid-director-of-customer-services--nyc-based-in-new-york-at-carbyne
